{
  "$schema": "../schema/catalog-item.schema.json",
  "id": "cloud-cost-report-aws",
  "version": "1.0.0",
  "enabled": true,
  "name": "AWS cost report (idle resources)",
  "category": "Cloud Ops",
  "icon": "cloud",
  "summary": "Find billable idle resources in AWS with a monthly list-price estimate.",
  "description": "Read-only report of unattached EBS volumes, unused Elastic IPs, instances stopped for a long time (EBS still billed) and snapshots older than 180 days, plus which resources carry the power schedule tag. Amounts are list-price estimates (USD, no discounts) to prioritise clean-up.",
  "owner": "Cloud Operations",
  "tags": [
    "AWS",
    "Cost",
    "FinOps",
    "Report"
  ],
  "estimatedDuration": "2-5 min",
  "access": {
    "roles": [
      "Requester",
      "Approver",
      "Admin"
    ],
    "teams": [
      "Cloud"
    ]
  },
  "approval": {
    "required": false
  },
  "execution": {
    "handler": "Get-CloudCostReport.ps1",
    "requiresVCenter": false,
    "cloud": "aws",
    "timeoutMinutes": 30,
    "fixedParameters": {}
  },
  "inputs": [
    {
      "name": "StoppedDaysThreshold",
      "label": "Stopped / deallocated for at least (days)",
      "type": "number",
      "group": "Options",
      "required": true,
      "default": 7,
      "help": "Instances / VMs powered off for fewer days are not reported.",
      "validation": {
        "min": 1,
        "max": 365
      }
    }
  ]
}
